author,quote_text,tags,likes
"Lemony Snicket,","Everyone should be able to do one card trick, tell two jokes, and recite three poems, in case they are ever trapped in an elevator.",funny,6403
"Jamie McGuire,","To douchebags!"" he said, gesturing to Brad. ""And to girls that break your heart,"" he bowed his head to me. His eyes lost focus. ""And to the absolute fucking horror of losing your best friend because you were stupid enough to fall in love with her.","best-friends,heartbreak,love",6393
"Douglas Coupland,",Remember: the time you feel lonely is the time you most need to be by yourself. Life's cruelest irony.,"irony,life,loneliness",6382
"Edgar Allan Poe,",I have great faith in fools - self-confidence my friends will call it.,"faith,fool,humor,self-confidence,self-irony",6379
Jim Morrison,"People are afraid of themselves, of their own reality; their feelings most of all. People talk about how great love is, but that’s bullshit. Love hurts. Feelings are disturbing. People are taught that pain is evil and dangerous. How can they deal with love if they’re afraid to feel? Pain is meant to wake us up. People try to hide their pain. But they’re wrong. Pain is something to carry, like a radio. You feel your strength in the experience of pain. It’s all in how you carry it. That’s what matters. Pain is a feeling. Your feelings are a part of you. Your own reality. If you feel ashamed of them, and hide them, you’re letting society destroy your reality. You should stand up for your right to feel your pain.","jim,life,morrison,pain,reality",6375
Cicero,"If you have a garden and a library, you have everything you need.",books,6374
"Ursula K. Le Guin,","Love doesn't just sit there, like a stone, it has to be made, like bread; remade all the time, made new.",love,6371
"Leigh Bardugo,","Many boys will bring you flowers. But someday you'll meet a boy who will learn your favorite flower, your favorite song, your favorite sweet. And even if he is too poor to give you any of them, it won't matter because he will have taken the time to know you as no one else does. Only that boy earns your heart.","leigh-bardugo,six-of-crows",6368
Terry Pratchett,Stories of imagination tend to upset those without one.,"fantasy,humor,imagination,literature,stories",6356
"Charles Bukowski,",You have to die a few times before you can really,,6341
"C.S. Lewis,","Imagine yourself as a living house. God comes in to rebuild that house. At first, perhaps, you can understand what He is doing. He is getting the drains right and stopping the leaks in the roof and so on; you knew that those jobs needed doing and so you are not surprised. But presently He starts knocking the house about in a way that hurts abominably and does not seem to make any sense. What on earth is He up to? The explanation is that He is building quite a different house from the one you thought of - throwing out a new wing here, putting on an extra floor there, running up towers, making courtyards. You thought you were being made into a decent little cottage: but He is building a palace. He intends to come and live in it Himself.",god-religion-house,6334
"David Sedaris,",If you're looking for sympathy you'll find it between shit and syphilis in the dictionary.,sympathy,6325
"Suzanne Collins,",Stupid people are dangerous.,,6315
Mahatma Gandhi,Prayer is not asking. It is a longing of the soul. It is daily admission of one's weakness. It is better in prayer to have a heart without words than words without a heart.,"god,heart,humanity,inspirational,prayer,religion,souls,weakness",6309
Pamela Redmond Satran,A WOMAN SHOULD HAVE ....,,6303
Sigmund Freud,"One day, in retrospect, the years of struggle will strike you as the most beautiful.",inspirational-quotes,6298
"S.E. Hinton,",I lie to myself all the time. But I never believe me.,"lies,lying,self-deception,truth",6283
"Daphne Rae,","I have found the paradox, that if you love until it hurts, there can be no more hurt, only more love.",misattributed-to-mother-teresa,6278
"John Green,","Some tourists think Amsterdam is a city of sin, but in truth it is a city of freedom. And in freedom, most people find sin.","amsterdam,freedom,sin",6273
"Candace Bushnell,","Man may have discovered fire, but women discovered how to play with it.","love,relationships",6271
"Cassandra Clare,","That does it,"" said Jace. ""I'm going to get you a dictionary for Christmas this year.""","dictionary,fun,humor,isabelle-lightwood,jace-wayland",6268
Walt Disney,Laughter is timeless. Imagination has no age. And dreams are forever.,,6265
"John Green,",They love their hair because they're not smart enough to love something more interesting.,"awesomeness,funny",6262
Nelson Mandela,Education is the most powerful weapon which you can use to change the world.,"change,education",6255
Oscar Wilde,"I think God, in creating man, somewhat overestimated his ability.","creation,god,humor,man",6254
"Charles Bukowski,",My ambition is handicapped by laziness,,6253
"Christopher Paolini,","Books are my friends, my companions. They make me laugh and cry and find meaning in life.","books,christopher-paolini,eragon,good-reads",6249
"Ray Bradbury,","I have never listened to anyone who criticized my taste in space travel, sideshows or gorillas. When this occurs, I pack up my dinosaurs and leave the room.","humour,individuality,science-fiction",6248
John Lennon,"As usual, there is a great woman behind every idiot.","beatles,men,women",6246
Charles Bukowski,"The problem with the world is that the intelligent people are full of doubts, while the stupid ones are full of confidence.",,6245
Roy T. Bennett,"Don’t waste your time in anger, regrets, worries, and grudges. Life is too short to be unhappy.","anger,grudge,happiness,happy,inspiration,inspirational,inspirational-quotes,inspire,inspiring,life,life-quotes,living,optimism,optimistic,positive,positive-affirmation,positive-life,positive-thinking,regret,time,worry",6237
Marilyn Monroe,Beneath the makeup and behind the smile I am just a girl who wishes for the world.,"attributed-no-source,girl,makeup,world",6226
Winston S. Churchill,"If you are going through hell, keep going.","hell,perseverance",6219
"Lewis Carroll,","But I don’t want to go among mad people,"" Alice remarked.",alice-s-adventures-in-wonderland,6213
"Katie McGarry,",I don't go looking for trouble. Trouble usually finds me.,trouble,6205
"Chuck Palahniuk,",Nothing of me is original. I am the combined effort of everyone I've ever known.,"identity,originality",6192
Mark Twain,"But who prays for Satan? Who, in eighteen centuries, has had the common humanity to pray for the one sinner that needed it most?",humor-satan,6191
Anthony G. Oettinger,Time flies like an arrow; fruit flies like a banana.,"humor,misattributed-to-groucho-marx,time",6189
"William Goldman,","Life is pain, highness. Anyone who says differently is selling something.","life,pain",6186
"Dale Carnegie,",It isn't what you have or who you are or where you are or what you are doing that makes you happy or unhappy. It is what you think about it.,"attitude,contentment,happiness,inspirational,life",6183
Dr. Seuss,Being crazy isn't enough.,crazy,6182
"Suzanne Collins,","What I need is the dandelion in the spring. The bright yellow that means rebirth instead of destruction. The promise that life can go on, no matter how bad our losses. That it can be good again.","inspirational,love",6176
William Faulkner,"Never be afraid to raise your voice for honesty and truth and compassion against injustice and lying and greed. If people all over the world...would do this, it would change the earth.","advocacy,dissent,protest,truth,truth-telling",6175
Mahatma Gandhi,"I like your Christ, I do not like your Christians. Your Christians are so unlike your Christ.","anti-christian,christianity,christians,jesus-christ",6175
"Mark Twain,",The difference between the,writing,6160
"Rick Riordan,",Deadlines just aren't real to me until I'm staring one in the face.,"deadlines,humor,procrastinate",6145
Maya Angelou,"I don't trust people who don't love themselves and tell me, 'I love you.' ... There is an African saying which is: Be careful when a naked person offers you a shirt.","1997,annie-clark-tanner-lecture,inspirational,love,trust",6139
"Oscar Wilde,",I never travel without my diary. One should always have something sensational to read in the train.,"drama,humor,plays",6135
Kahlil Gibran,"If you love somebody, let them go, for if they return, they were always yours. If they don't, they never were.","life,love,romance",6129
"Chuck Palahniuk,","What I want is to be needed. What I need is to be indispensable to somebody. Who I need is somebody that will eat up all my free time, my ego, my attention. Somebody addicted to me. A mutual addiction.",love,6127
"Patrick Rothfuss,","There are three things all wise men fear: the sea in storm, a night with no moon, and the anger of a gentle man.","fear,name-of-the-wind,patrick-rothfuss,wisdom",6124
"Terry Pratchett,","Why do you go away? So that you can come back. So that you can see the place you came from with new eyes and extra colors. And the people there see you differently, too. Coming back to where you started is not the same as never leaving.","adventure,change,discworld,growth,travel",6115
"Paul Auster,","Reading was my escape and my comfort, my consolation, my stimulant of choice: reading for the pure pleasure of it, for the beautiful stillness that surrounds you when you hear an author's words reverberating in your head.","books,reading",6113
Bette Davis,"When a man gives his opinion, he's a man. When a woman gives her opinion, she's a bitch.","clichés,double-standards,empowerment,feminism,gender,hypocrisy,misogyny,opinions,speaking-out,stereotypes,women",6112
William Faulkner,You cannot swim for new horizons until you have courage to lose sight of the shore.,"courage,determination,hope,risk",6111
J.K. Rowling,"Books are like mirrors: if a fool looks in, you cannot expect a genius to look out.",books,6094
"J.K. Rowling,",Percy wouldn't notice a joke if it danced naked in front of him wearing one of Dobby's hats.,humor,6093
"Antoine de Saint-Exupéry,","Love does not consist of gazing at each other, but in looking outward together in the same direction.",love,6088
Coco Chanel,A girl should be two things: classy and fabulous.,"beauty,class,fashion,girls,women",6075
"Roy T. Bennett,",Don't Just,"act,action,change,criticize,doing,dream,dreams,encouragement,experience,feeling,giving,inspiration,inspirational,inspirational-attitude,inspirational-life,inspirational-quote,inspirational-quotes,inspire,inspiring,learning,life,life-and-living,life-lessons,life-philosophy,life-quotes,listening,living,optimism,optimistic,ponder,positive,positive-affirmation,positive-life,positive-thinking,thinking,transform",6073
Roy T. Bennett,"Don't let the expectations and opinions of other people affect your decisions. It's your life, not theirs. Do what matters most to you; do what makes you feel alive and happy. Don't let the expectations and ideas of others limit who you are. If you let others tell you who you are, you are living their reality — not yours. There is more to life than pleasing people. There is much more to life than following others' prescribed path. There is so much more to life than what you experience right now. You need to decide who you are for yourself. Become a whole being. Adventure.","action,adventure,authentic-living,authentic-self,authenticity,confidence,experience,inspiration,inspirational,inspirational-quotes,inspire,inspiring,life,life-quotes,living,optimism,optimistic,positive,positive-affirmation,positive-life,positive-thinking,who-you-are,whole-being",6068
"J.R.R. Tolkien,","It's a dangerous business, Frodo, going out your door. You step onto the road, and if you don't keep your feet, there's no knowing where you might be swept off to.",wisdom,6054
Mark Twain,"I do not fear death. I had been dead for billions and billions of years before I was born, and had not suffered the slightest inconvenience from it.","death,inspirational",6052
Pablo Picasso,Every child is an artist. The problem is how to remain an artist once he grows up.,"art,attributed-no-source",6047
"Henry Rollins,","It hurts to let go. Sometimes it seems the harder you try to hold on to something or someone the more it wants to get away. You feel like some kind of criminal for having felt, for having wanted. For having wanted to be wanted. It confuses you, because you think that your feelings were wrong and it makes you feel so small because it's so hard to keep it inside when you let it out and it doesn't coma back. You're left so alone that you can't explain. Damn, there's nothing like that, is there? I've been there and you have too. You're nodding your head.","life,love,relationships",6040
Audrey Hepburn,"I love people who make me laugh. I honestly think it's the thing I like most, to laugh. It cures a multitude of ills. It's probably the most important thing in a person.",laughter,6035
C.S. Lewis,No book is really worth reading at the age of ten which is not equally – and often far more – worth reading at the age of fifty and beyond.,"age,books,re-reading,reading",6035
"Nicholas Sparks,","My daddy said, that the first time you fall in love, it changes you forever and no matter how hard you try, that feeling just never goes away.","love,nicholas,nicholas-sparks,sparks,the-notebook",6028
"Walt Whitman,","Resist much, obey little.",poetry,6026
Eleanor Roosevelt,The future belongs to those who believe in the beauty of their dreams.,"dreams,future,inspirational,misattributed-eleanor-roosevelt",6013
"Veronica Roth,",I have a theory that selflessness and bravery aren't all that different.,,6012
Bob Marley,Some people feel the rain. Others just get wet.,,6005
"Paul McCartney,","And, in the end","beatles,inspirational,live,love,music",5994
"Jane Austen,",Angry people are not always wise.,"anger,jane-austen,wisdom",5994
Roy T. Bennett,"It’s only after you’ve stepped outside your comfort zone that you begin to change, grow, and transform.","change,focus,grow,growth,inspiration,inspirational,inspirational-quotes,inspire,inspiring,leader,leaders,leadership,life,life-quotes,living,motivation,motivational,optimism,optimistic,positive,positive-affirmation,positive-life,positive-thinking,stay-focused,step-out-of-comfort-zone,transform",5986
"Vladimir Nabokov,","It was love at first sight, at last sight, at ever and ever sight.","humbert-humbert,love",5983
Greg Behrendt,"If he’s not calling you, it’s because you are not on his mind. If he creates expectations for you, and then doesn’t follow through on little things, he will do same for big things. Be aware of this and realize that he’s okay with disappointing you. Don’t be with someone who doesn’t do what they say they’re going to do. If he’s choosing not to make a simple effort that would put you at ease and bring harmony to a recurring fight, then he doesn’t respect your feelings and needs. Busy is another word for asshole. Asshole is another word for the guy you’re dating. You deserve a fcking phone call.","busy,call,dating,dating-advice,faith,greg-behrendt,guys,he-s-not-just-into-you,love,marriage,romance,true",5968
Confucious,"By three methods we may learn wisdom: First, by reflection, which is noblest; Second, by imitation, which is easiest; and third by experience, which is the bitterest.",wisdom,5967
Agatha Christie,"I like living. I have sometimes been wildly, despairingly, acutely miserable, racked with sorrow; but through it all I still know quite certainly that just to be alive is a grand thing.",inspirational,5966
"Neil Gaiman,","Everybody has a secret world inside of them. I mean everybody. All of the people in the whole world, I mean everybody — no matter how dull and boring they are on the outside. Inside them they've all got unimaginable, magnificent, wonderful, stupid, amazing worlds... Not just one world. Hundreds of them. Thousands, maybe.",,5965
"Chuck Palahniuk,",I don't want to die without any scars.,"death,scars,tyler-durden",5961
"Mark Twain,","Truth is stranger than fiction, but it is because Fiction is obliged to stick to possibilities; Truth isn't.","books,truth",5952
"William Shakespeare,","If music be the food of love, play on;","music,romance,unrequited-love",5943
Mark Twain,"Loyalty to country ALWAYS. Loyalty to government, when it deserves it.","patriotism,politics",5941
Irwin Shaw,"There are too many books I haven’t read, too many places I haven’t seen, too many memories I haven’t kept long enough.",,5937
"Marilyn Monroe,","I don't mind living in a man's world, as long as I can be a woman in it.",,5933
Winston S. Churchill,My tastes are simple: I am easily satisfied with the best.,"humor,taste",5921
C.S. Lewis,To be a Christian means to forgive the inexcusable because God has forgiven the inexcusable in you.,"christianity,forgiveness,god",5900
"William Shakespeare,","When he shall die,","death,light,stars",5888
"Roy T. Bennett,","Even if you cannot change all the people around you, you can change the people you choose to be around. Life is too short to waste your time on people who don’t respect, appreciate, and value you. Spend your life with people who make you smile, laugh, and feel loved.","appreciate,change,happiness,inspiration,inspirational,inspirational-attitude,inspirational-life,inspirational-quotes,inspire,inspiring,laugh,life,life-and-living,life-lessons,life-quotes,living,love,optimism,optimistic,positive,positive-affirmation,positive-life,positive-thinking,relationship,respect,smile,value",5883
"Roy T. Bennett,","You cannot control the behavior of others, but you can always choose how you respond to it.","choices,choose,inspiration,inspirational,inspirational-attitude,inspirational-life,inspirational-quotes,inspire,inspiring,life,life-and-living,life-lessons,life-quotes,living,optimism,optimistic,positive,positive-affirmation,positive-life,positive-thinking",5856
F. Scott Fitzgerald,"Show me a hero, and I'll write you a tragedy.",f-scott-fitzgerald,5856
"Suzanne Collins,",I don't want to lose the boy with the bread.,,5848
Rumi,"Yesterday I was clever, so I wanted to change the world. Today I am wise, so I am changing myself.","change,cleverness,misattributed,self,wisdom,world",5846
Stephen King,Fiction is the truth inside the lie.,writing,5842
Anton Chekhov,Don't tell me the moon is shining; show me the glint of light on broken glass.,"broken-glass,glass,moon,moonshine,show-don-t-tell,writing",5840
Marilyn Monroe,"The nicest thing for me is sleep, then at least I can dream.",,5825
"Rick Riordan,","Wow,"" Thalia muttered. ""Apollo is hot.""","apollo,gods,hot,olympians,percy-jackson,sun,thalia",5820
Mortimer J. Adler,"In the case of good books, the point is not to see how many of them you can get through, but rather how many can get through to you.","books,reading",5818
"Louisa May Alcott,","She is too fond of books, and it has turned her brain.",books,5815
"Leigh Bardugo,","Kaz leaned back. ""What's the easiest way to steal a man's wallet?""",,5814
"Roy T. Bennett,","More smiling, less worrying. More compassion, less judgment. More blessed, less stressed. More love, less hate.","authentic-living,being-positive,blessed,compassion,hate,inspiration,inspirational,inspirational-quotes,judgment,less-more,life,life-purpose,life-quotes,living,love,mind,motivation,optimism,optimistic,positive,positive-affirmation,positive-life,positive-thinking,smile,smiles,spirituality,stress,stressed,worry,worrying",5798
"John Green,","It's a metaphor, see: You put the killing thing right between your teeth, but you don't give it the power to do its killing.","john-green,the-fault-in-our-stars",5795
"Markus Zusak,","Like most misery, it started with apparent happiness.",,5794
"Patrick Ness,",You do not write your life with words...You write it with actions. What you think is not important. It is only important what you,"philosophy,wisdom",5791
"Lewis Carroll,","She generally gave herself very good advice, (though she very seldom followed it).",,5791
"Anonymous,","And now these three remain: faith, hope and love. But the greatest of these is love.","faith,god,hope,love",5779
"Kurt Vonnegut,",Everything was beautiful and nothing hurt.,,5777
"Haruki Murakami,","Why do people have to be this lonely? What's the point of it all? Millions of people in this world, all of them yearning, looking to others to satisfy them, yet isolating themselves. Why? Was the earth put here just to nourish human loneliness?","isolation,loneliness,sadness",5776
"John Green,","What is an ""instant"" death anyway? How long is an instant? Is it one second? Ten? The pain of those seconds must have been awful as her heart burst and her lungs collapsed and there was no air and no blood to her brain and only raw panic. What the hell is instant? Nothing is instant. Instant rice takes five minutes, instant pudding an hour. I doubt that an instant of blinding pain feels particularly instantaneous.",looking-for-alaska,5774
Mother Teresa,"I am not sure exactly what heaven will be like, but I know that when we die and it comes time for God to judge us, He will not ask, 'How many good things have you done in your life?' rather He will ask, 'How much love did you put into what you did?","inspirational,love",5769
"Douglas Adams,","The fact that we live at the bottom of a deep gravity well, on the surface of a gas covered planet going around a nuclear fireball 90 million miles away and think this to be normal is obviously some indication of how skewed our perspective tends to be.","humor,perspective,science",5766
Gabriel García Márquez,No medicine cures what happiness cannot.,happiness,5758
"Stephen Chbosky,","It's strange because sometimes, I read a book, and I think I am the people in the book.",books-reading,5755
"Oscar Wilde,","With freedom, flowers, books, and the moon, who could not be perfectly happy?",,5753
"Stephen Chbosky,","It's just that I don't want to be somebody's crush. If somebody likes me, I want them to like the real me, not what they think I am. And I don't want them to carry it around inside. I want them to show me, so I can feel it too.",,5748
"Fyodor Dostoevsky,",To go wrong in one's own way is better than to go right in someone else's.,"independent-thought,self-determination,self-expression",5741
"Cassandra Clare,","Will looked horrified. ""What kind of monster could possibly hate chocolate?","chocolate,monsters",5739
"Andrew  Boyd,","We’re all seeking that special person who is right for us. But if you’ve been through enough relationships, you begin to suspect there’s no right person, just different flavors of wrong. Why is this? Because you yourself are wrong in some way, and you seek out partners who are wrong in some complementary way. But it takes a lot of living to grow fully into your own wrongness. And it isn’t until you finally run up against your deepest demons, your unsolvable problems—the ones that make you truly who you are—that we’re ready to find a lifelong mate. Only then do you finally know what you’re looking for. You’re looking for the wrong person. But not just any wrong person: it's got to be the right wrong person—someone you lovingly gaze upon and think, This is the problem I want to have.","being-loved,completion,inspirational,love,relationships",5738
Stephen King,"The most important things are the hardest to say. They are the things you get ashamed of, because words diminish them -- words shrink things that seemed limitless when they were in your head to no more than living size when they're brought out. But it's more than that, isn't it? The most important things lie too close to wherever your secret heart is buried, like landmarks to a treasure your enemies would love to steal away. And you may make revelations that cost you dearly only to have people look at you in a funny way, not understanding what you've said at all, or why you thought it was so important that you almost cried while you were saying it. That's the worst, I think. When the secret stays locked within not for want of a teller but for want of an understanding ear.",writing,5728
"J.K. Rowling,","You haven't got a letter on yours,"" George observed. ""I suppose she thinks you don't forget your name. But we're not stupid-we know we're called Gred and Forge.",humor,5714
"Suzanne Collins,",My nightmares are usually about losing you. I'm okay once I realize you're here.,romantic,5713
"Stephen King,",The road to hell is paved with adverbs.,writing,5713
"Rick Riordan,","Love conquers all,"" Aphrodite promised. ""Look at Helen and Paris. Did they let anything come between them?""","humor,true-love",5708
"John Green,","The town was paper, but the memories were not.",memories,5699
