author,quote_text,tags,likes
Coco Chanel,"It’s probably not just by chance that I’m alone. It would be very hard for a man to live with me, unless he’s terribly strong. And if he’s stronger than I, I’m the one who can’t live with him. … I’m neither smart nor stupid, but I don’t think I’m a run-of-the-mill person. I’ve been in business without being a businesswoman, I’ve loved without being a woman made only for love. The two men I’ve loved, I think, will remember me, on earth or in heaven, because men always remember a woman who caused them concern and uneasiness. I’ve done my best, in regard to people and to life, without precepts, but with a taste for justice.","autonomy,bachelorhood,empowerment,freedom,independence,individuality,love,marriage,matrimony,men,self-determination,self-sufficiency,singles,strength,women",3947
"Suzanne Collins,","You here to finish me off, Sweetheart?","humor,hunger-games,katniss,mellark,peeta,romance",3944
"Lucy Maud Montgomery,",It's been my experience that you can nearly always enjoy things if you make up your mind firmly that you will.,happiness,3942
"Nicholson Baker,",I woke up thinking a very pleasant thought. There is lots left in the world to read.,,3940
"Ralph Ellison,",What and how much had I lost by trying to do only what was expected of me instead of what I myself had wished to do?,,3939
"Roy T. Bennett,",Never lose hope. Storms make people stronger and never last forever.,"adversity,difficulty,hope,inspiration,inspirational,inspirational-attitude,inspirational-life,inspirational-quotes,inspire,inspiring,life,life-and-living,life-lessons,life-quotes,living,motivation,motivational,optimism,optimistic,perseverance,persistence,positive,positive-affirmation,positive-life,positive-thinking,storms",3938
"Haruki Murakami,",Don't feel sorry for yourself. Only assholes do that.,nagasawa,3938
Stephen Hawking,We are just an advanced breed of monkeys on a minor planet of a very average star. But we can understand the Universe. That makes us something very special.,"inspirational,science",3936
Scott Adams,I love you like a fat kid loves cake!,"food,humor,love",3936
"Ally Condie,",Growing apart doesn't change the fact that for a long time we grew side by side; our roots will always be tangled. I'm glad for that.,"childhood,friendship,growing-up",3933
"Fernando Pessoa,",Literature is the most agreeable way of ignoring life.,"literature,reading,solitude",3933
"Stephenie Meyer,",Look after my heart - I've left it with you.,"bella,edward,love,twilight-saga",3932
Stephen King,"If you want to be a writer, you must do two things above all others: read a lot and write a lot.",writing,3929
"Christopher Paolini,","Live in the present, remember the past, and fear not the future, for it doesn't exist and never shall. There is only now.",inspirational,3929
"William Shakespeare,",These violent delights have violent ends,"romeo-and-juliet,shakespeare",3929
"Jonathan Safran Foer,","It was not the feeling of completeness I so needed, but the feeling of not being empty.","emptiness,life",3928
"F. Scott Fitzgerald,","He smiled understandingly-much more than understandingly. It was one of those rare smiles with a quality of eternal reassurance in it, that you may come across four or five times in life. It faced--or seemed to face--the whole eternal world for an instant, and then concentrated on you with an irresistible prejudice in your favor. It understood you just as far as you wanted to be understood, believed in you as you would like to believe in yourself, and assured you that it had precisely the impression of you that, at your best, you hoped to convey.",smiling,3926
"Sylvia Plath,",I shut my eyes and all the world drops dead;,poetry,3926
"F. Scott Fitzgerald,","I wasn't actually in love, but I felt a sort of tender curiosity.","affection,amity,love",3924
"Raymond Chandler,",To say goodbye is to die a little.,"change,life,parting,romantics",3923
"Nicholas Sparks,","And when her lips met mine, I knew that I could live to be a hundred and visit every country in the world, but nothing would ever compare to that single moment when I first kissed the girl of my dreams and knew that my love would last forever.","bestseller,love,nicholas-sparks,north-carolina,novel",3922
Bill  Nye,Everyone you will ever meet knows something you don't.,,3920
"Ralph Ellison,","When I discover who I am, I’ll be free.","freedom,identity,independence,self-awareness,self-discovery",3920
Friedrich Nietzsche,I cannot believe in a God who wants to be praised all the time.,"agama,agnosticism,prayer,religion",3918
"Patrick Rothfuss,","Words are pale shadows of forgotten names. As names have power, words have power. Words can light fires in the minds of men. Words can wring tears from the hardest hearts.","description,language,power-of-words,words",3916
"J.R. Ward,","Welcome to the wonderful world of jealousy, he thought. For the price of admission, you get a splitting headache, a nearly irresistable urge to commit murder, and an inferiority complex. Yippee.","humor,jealousy,love",3915
Pablo Neruda,"I crave your mouth, your voice, your hair.","love,poetry",3915
W.P. Kinsella,"Success is getting what you want, happiness is wanting what you get","happiness,success",3914
Paulo Coelho,Don't waste your time with explanations: people only hear what they want to hear.,"attitude,explain,gossip,life,people,public-opinion,time,wisdom",3907
"John Steinbeck,",All great and precious things are lonely.,loneliness,3905
"Douglas Adams,",Time is an illusion. Lunchtime doubly so.,"humor,philosophy,science-fiction",3904
Voltaire,It is forbidden to kill; therefore all murderers are punished unless they kill in large numbers and to the sound of trumpets.,"double-standards,ethics,governments,humor,irony,killing,law,mankind,morality,murder,nationalism,nations,war",3900
Anne Frank,"I can shake off everything as I write; my sorrows disappear, my courage is reborn.",writing,3898
Eckhart Tolle,The past has no power over the present moment.,"education,inspirational,life,philosophy,truth,wisdom",3897
"Alan Bennett,","The best moments in reading are when you come across something – a thought, a feeling, a way of looking at things – which you had thought special and particular to you. Now here it is, set down by someone else, a person you have never met, someone even who is long dead. And it is as if a hand has come out and taken yours.","books,history,reading",3896
George Bernard Shaw,"If you want to tell people the truth, make them laugh, otherwise they'll kill you.","kill,laughter,misattributed-oscar-wilde,truth",3890
"Mark Twain,","Travel is fatal to prejudice, bigotry, and narrow-mindedness, and many of our people need it sorely on these accounts. Broad, wholesome, charitable views of men and things cannot be acquired by vegetating in one little corner of the earth all one's lifetime.",travel,3887
"J.K. Rowling,","Yeah, Quirrell was a great teacher. There was just that minor drawback of him having Lord Voldemort sticking out of the back of his head!",humor,3887
Ian Fleming,"Never say 'no' to adventures. Always say 'yes,' otherwise you'll lead a very dull life.",,3880
Anne Lamott,"You will lose someone you can’t live without,and your heart will be badly broken, and the bad news is that you never completely get over the loss of your beloved. But this is also the good news. They live forever in your broken heart that doesn’t seal back up. And you come through. It’s like having a broken leg that never heals perfectly—that still hurts when the weather gets cold, but you learn to dance with the limp.","grief,loss,recovery",3876
"Lois Lowry,",Take pride in your pain; you are stronger than those who have none,,3874
Albert Camus,"In the midst of winter, I found there was, within me, an invincible summer.",,3872
Ralph Waldo Emerson,What you do speaks so loudly that I cannot hear what you say.,,3872
Kurt Vonnegut,"Hello babies. Welcome to Earth. It's hot in the summer and cold in the winter. It's round and wet and crowded. On the outside, babies, you've got a hundred years here. There's only one rule that I know of, babies-""God damn it, you've got to be kind.",fact,3872
Ivan Turgenev,"If we wait for the moment when everything, absolutely everything is ready, we shall never begin.",,3868
George Carlin,"Have you ever noticed that anybody driving slower than you is an idiot, and anyone going faster than you is a maniac?",humor,3868
Emily Dickinson,That it will never come again is what makes life so sweet.,life,3868
"Joel Osteen,","You must make a decision that you are going to move on. It wont happen automatically. You will have to rise up and say, ‘I don’t care how hard this is, I don’t care how disappointed I am, I’m not going to let this get the best of me. I’m moving on with my life.","disappointment,failure,moving-on",3866
Clare Boothe Luce,"Money can't buy happiness, but it can make you awfully comfortable while you're being miserable.",,3864
"Roy T. Bennett,",Do not fear failure but rather fear not trying.,"failure,fearless,inspiration,inspirational,inspirational-attitude,inspirational-life,inspirational-quote,inspirational-quotes,inspire,inspiring,life,life-and-living,life-lessons,life-philosophy,life-quotes,living,motivation,motivational,never-give-up,optimism,optimistic,persistence,positive,positive-affirmation,positive-life,positive-thinking,trying",3860
Paulo Coelho,"Love is an untamed force. When we try to control it, it destroys us. When we try to imprison it, it enslaves us. When we try to understand it, it leaves us feeling lost and confused.",love,3860
"Cassandra Clare,","They’re not hideous, said Tessa.",,3859
"Ernest Hemingway,","Maybe...you'll fall in love with me all over again.""","infatuation,love",3856
Robert Frost,Education is the ability to listen to almost anything without losing your temper or your self-confidence.,education,3856
Jalal Ad-Din Rumi,"Knock, And He'll open the door","islam,religion,spirituality",3855
"Jon Krakauer,",Happiness [is] only real when shared,"family,happiness,inspirational,love,marriage",3852
A.A. Milne,"How do you spell 'love'?"" - Piglet","love,piglet,pooh-bear,winnie-the-pooh",3851
"Sarah Dessen,","So you're always honest,"" I said.","lies,truth",3846
Milan Kundera,You can't measure the mutual affection of two human beings by the number of words they exchange.,love,3841
"Sarah J. Maas,","We all bear scars,... Mine just happen to be more visible than most.",,3840
Voltaire,"‎Life is a shipwreck, but we must not forget to sing in the lifeboats.",inspirational,3837
"Cassandra Clare,","Clary,","cassandra-clare,city-of-fallen-angels,city-of-glass,clary-fray,herondale,jace-lightwood,letter,morgenstern,mortal-instruments,wayland",3837
"Cassandra Clare,","The meek may inherit the earth, but at the moment it belongs to the conceited. Like me.","city-of-bones,humor,jace-wayland,quotes",3833
"Cormac McCarthy,",You never know what worse luck your bad luck has saved you from.,luck,3827
"Suzanne Collins,","So it's you and a syringe against the Capitol? See, this is why no one lets you make the plans.","awesome-quote,haymitch",3825
"William Shakespeare,","Though she be but little, she is fierce!",ferocity,3824
W. Somerset Maugham,"There are three rules for writing a novel. Unfortunately, no one knows what they are.",writing,3823
John Locke,Reading furnishes the mind only with materials of knowledge; it is thinking that makes what we read ours.,"knowledge,reading,thinking",3820
Christopher Paolini,"Books should go where they will be most appreciated, and not sit unread, gathering dust on a forgotten shelf, don't you agree?","books,reading",3816
"Stephen King,","you can, you should, and if you’re brave enough to start, you will.","bravery,positive-thinking,self-empowerment,writing",3814
"Nicholas Sparks,",Every great love starts with a great story...,"romance,storytelling",3814
Marjorie Pay Hinckley,The only way to get through life is to laugh your way through it. You either have to laugh or cry. I prefer to laugh. Crying gives me a headache.,"humour,wisdom",3812
"Nicholas Sparks,","Life, he realize, was much like a song. In the beginning there is mystery, in the end there is confirmation, but it's in the middle where all the emotion resides to make the whole thing worthwhile.","life,love,music,simile,song",3809
"Norton Juster,",So many things are possible just as long as you don't know they're impossible.,,3809
James Baldwin,"You think your pain and your heartbreak are unprecedented in the history of the world, but then you read.",,3808
Rick Riordan,"I nodded, looking at Rachel with respect. ""You hit the Lord of the Titans in the eye with a blue plastic hairbrush.","percy-jackson,rachel-elizabeth-dare",3808
"Leo Tolstoy,","He stepped down, trying not to look long at her, as if she were the sun, yet he saw her, like the sun, even without looking.",romantic,3808
"Leigh Bardugo,","Jesper knocked his head against the hull and cast his eyes heavenward. Fine. But if Pekka Rollins kills us all, I’m going to get Wylan’s ghost to teach my ghost how to play the flute just so that I can annoy the hell out of your ghost.","funny,ghost,jesper,six-of-crows",3806
Ralph Waldo Emerson,"When it is dark enough, you can see the stars.","dark,stars",3806
Johann Wolfgang von Goethe,"If you treat an individual as he is, he will remain how he is. But if you treat him as if he were what he ought to be and could be, he will become what he ought to be and could be.",inspiration,3805
Mae West,Every man I meet wants to protect me. I can't figure out what from.,"chivalry,men,protection,relationships,women",3804
"Shawn Slovo,","Love is a temporary madness, it erupts like volcanoes and then subsides. And when it subsides, you have to make a decision. You have to work out whether your roots have so entwined together that it is inconceivable that you should ever part. Because this is what love is. Love is not breathlessness, it is not excitement, it is not the promulgation of promises of eternal passion, it is not the desire to mate every second minute of the day, it is not lying awake at night imagining that he is kissing every cranny of your body. No, don't blush, I am telling you some truths. That is just being ""in love"", which any fool can do. Love itself is what is left over when being in love has burned away, and this is both an art and a fortunate accident.",love,3802
"Stewart O'Nan,","You couldn't relive your life, skipping the awful parts, without losing what made it worthwhile. You had to accept it as a whole--like the world, or the person you loved.","acceptance,life,love,worth",3795
"Gayle Forman,",I realize now that dying is easy. Living is hard.,,3795
Rob Reiner,"Everybody talks about wanting to change things and help and fix, but ultimately all you can do is fix yourself. And that's a lot. Because if you can fix yourself, it has a ripple effect.",,3794
"George Bernard Shaw,",The reasonable man adapts himself to the world: the unreasonable one persists in trying to adapt the world to himself. Therefore all progress depends on the unreasonable man.,"life,philosophy,philosophy-of-life,progress",3793
"Tennessee Williams,","If I got rid of my demons, I’d lose my angels.","angels,demons",3793
Joseph Campbell,We must be willing to let go of the life we planned so as to have the life that is waiting for us.,"change,life,open-heart,open-mind,resilience",3793
Johnny Cash,"All your life, you will be faced with a choice. You can choose love or hate…I choose love.",,3790
Elizabeth Peters,No woman really wants a man to carry her off; she only wants him to want to do it.,"amelia-peabody,men,women",3788
"Stephen Chbosky,","And I thought about how many people have loved those songs. And how many people got through a lot of bad times because of those songs. And how many people enjoyed good times with those songs. And how much those songs really mean. I think it would be great to have written one of those songs. I bet if I wrote one of them, I would be very proud. I hope the people who wrote those songs are happy. I hope they feel it's enough. I really do because they've made me happy. And I'm only one person.","music,songs",3788
"Cassandra Clare,","I could not tell you if I loved you the first moment I saw you, or if it was the second or third or fourth. But I remember the first moment I looked at you walking toward me and realized that somehow the rest of the world seemed to vanish when I was with you.","devotion,love,love-at-first-sight,true-love",3787
"John Green,","It's just that most really good-looking people are stupid, so I exceed expectations.'","john-green,the-fault-in-our-stars",3783
Walt Whitman,What is that you express in your eyes? It seems to me more than all the print I have read in my life.,poetry,3780
John A. Shedd,"A ship is safe in harbor, but that's not what ships are for.","courage,inspirational,misattributed-grace-hopper,misattributed-william-g-t-shedd,risk",3779
"F. Scott Fitzgerald,",Let us learn to show our friendship for a man when he is alive and not after he is dead.,,3777
Margaret Thatcher,"In politics, If you want anything said, ask a man. If you want anything done, ask a woman.","gender-roles,gender-stereotypes,men,women",3771
"Sarah J. Maas,",To the stars who listen—and the dreams that are answered.,,3766
A.A. Milne,I knew when I met you an adventure was going to happen.,,3765
"J.M. Barrie,",I'm not young enough to know everything.,wisdom,3764
Lao Tzu,Life is a series of natural and spontaneous changes. Don't resist them; that only creates sorrow. Let reality be reality. Let things flow naturally forward in whatever way they like.,"acceptance,change,life,reality,serenity",3758
"Roy T. Bennett,","Always find opportunities to make someone smile, and to offer random acts of kindness in everyday life.","acts-of-kindness,happiness,inspiration,inspirational,inspirational-attitude,inspirational-life,inspirational-quotes,inspire,inspiring,kindness,life,life-and-living,life-lessons,life-quotes,living,opportunity,optimism,optimistic,positive,positive-affirmation,positive-life,positive-thinking,smile",3755
Chinua Achebe,"If you don't like someone's story, write your own.",,3754
"William Shakespeare,",Cowards die many times before their deaths;,dramatist-quotes,3754
"Rick Riordan,","What if it lines up like it did in the Trojan War ... Athena versus Poseidon?""","annabeth-chase,athena,percy-jackson,poseidon",3753
"C.S. Lewis,","Crying is all right in its way while it lasts. But you have to stop sooner or later, and then you still have to decide what to do.","books,cry,crying,decisions",3752
"Annie Dillard,","She read books as one would breathe air, to fill up and live.","books,literature,reading,words",3751
"Henry van Dyke,",Time is,,3747
"J.K. Rowling,","Why were you lurking under our window?""","dursley,harry-potter,humor,news,sarcasm",3746
"Sarah Dessen,",It's a lot easier to be lost than found. It's the reason we're always searching and rarely discovered--so many locks not enough keys.,lock-and-key,3745
Shel Silverstein,If you are a dreamer come in,"dreamer,imagination,liar,make-believe,poetry,wisher,wishes",3743
"Jeffrey Eugenides,",Biology gives you a brain. Life turns it into a mind.,"brain,life,mind",3743
Rodney Dangerfield,"I came from a real tough neighborhood. Once a guy pulled a knife on me. I knew he wasn't a professional, the knife had butter on it.","crime,funny,humour,neighborhoods",3741
Vincent Van Gogh,Be clearly aware of the stars and infinity on high. Then life seems almost enchanted after all.,,3740
"Christopher Morley,",There is no mistaking a real book when one meets it. It is like falling in love.,"bibliophilia,books",3737
Émile Zola,"If you ask me what I came to do in this world, I, an artist, will answer you: I am here to live out loud.","art,calling,life",3736
"Nathaniel Hawthorne,",A single dream is more powerful than a thousand realities.,,3735
"Rick Riordan,","The real story of the Fleece: there were these two children of Zeus, Cadmus and Europa, okay? They were about to get offered up as human sacrifices, when they prayed to Zeus to save them. So Zeus sent this magical flying ram with golden wool, which picked them up in Greece and carried them all the way to Colchis in Asia Minor. Well, actually it carried Cadmus. Europa fell off and died along the way, but that's not important.""","annabeth-chase,gold,humor,percy-jackson",3733
"J.K. Rowling,","One can never have enough socks,"" said Dumbledore. ""Another Christmas has come and gone and I didn't get a single pair. People will insist on giving me books.","albus-dumbledore,books,christmas,desire,family,joke,socks",3732
Truman Capote,Failure is the condiment that gives success its flavor.,"experience,failure,metaphor,success,wisdom",3732
"Suzanne Collins,",And then he gives me a smile that just seems so genuinely sweet with just the right touch of shyness that unexpected warmth rushes through me.,"hunger-games,katniss-everdeen,love,peeta-mellark,smile,suzanne-collins",3730
A.A. Milne,"Sometimes,' said Pooh, 'the smallest things take up the most room in your heart.",,3729
"Jonathan Safran Foer,",I regret that it takes a life to learn how to live.,"close,extremely,foer,incredibly,jonathan,living,loud,safran",3727
"William Shakespeare,","To be, or not to be: that is the question:","death,existence,life",3725
Maurice Sendak,A book is really like a lover. It arranges itself in your life in a way that is beautiful.,,3724
"A.A. Milne,",Rivers know this: there is no hurry. We shall get there some day.,"patience,perseverance",3721
"Tina Fey,","Some people say, Never let them see you cry. I say, if you’re so mad you could just cry, then cry. It terrifies everyone.",humor,3720
Robert Jordan,"Any fool knows men and women think differently at times, but the biggest difference is this. Men forget, but never forgive; women forgive, but never forget.","forgiveness,men,women",3720
"Ayn Rand,","If you don't know, the thing to do is not to get scared, but to learn.","atlas,shrugged",3719
Mark Twain,"Everyone is a moon, and has a dark side which he never shows to anybody.","darkness,human-nature,moon",3718
Simon and Garfunkel,I've got nothing to do today but smile.,"happiness,life",3715
Edgar Allan Poe,There is no exquisite beauty… without some strangeness in the proportion.,"beauty,imperfections",3714
"Stephenie Meyer,","Before you, Bella, my life was like a moonless night. Very dark, but there were stars, points of light and reason. ...And then you shot across my sky like a meteor. Suddenly everything was on fire; there was brilliancy, there was beauty. When you were gone, when the meteor had fallen over the horizon, everything went black. Nothing had changed, but my eyes were blinded by the light. I couldn’t see the stars anymore. And there was no more reason, for anything.","edward,light,love,reason",3713
"Sylvia Plath,","And when at last you find someone to whom you feel you can pour out your soul, you stop in shock at the words you utter— they are so rusty, so ugly, so meaningless and feeble from being kept in the small cramped dark inside you so long.","confidences,secrets,sharing-secrets",3710
"Julian Barnes,",Books say: She did this because. Life says: She did this. Books are where things are explained to you; life is where things aren't. I'm not surprised some people prefer books.,"books,life",3708
Abraham Lincoln,"America will never be destroyed from the outside. If we falter and lose our freedoms, it will be because we destroyed ourselves.",,3705
"Deborah Reber,",Letting go doesn't mean that you don't care about someone anymore. It's just realizing that the only person you really have control over is yourself.,"acceptance,letting-go,love,moving-on",3702
"Neil Gaiman,","She says nothing at all, but simply stares upward into the dark sky and watches, with sad eyes, the slow dance of the infinite stars.",,3701
Marilyn Monroe,It's often just enough to be with someone. I don't need to touch them. Not even talk. A feeling passes between you both. You're not alone.,"feelings,not-alone",3700
Rumi,"When I am with you, we stay up all night.",love,3698
Socrates,I cannot teach anybody anything. I can only make them think,"knowledge,philosophy",3697
"Diana Gabaldon,","I stood still, vision blurring, and in that moment, I heard my heart break. It was a small, clean sound, like the snapping of a flower's stem.","claire-fraser,historical-fiction,romance,scotland,time-travel",3697
Isaac Asimov,"In life, unlike chess, the game continues after checkmate.",,3696
"Oscar Wilde,","All women become like their mothers. That is their tragedy. No man does, and that is his.",women-mothers,3696
"Milan Kundera,","Anyone whose goal is 'something higher' must expect someday to suffer vertigo. What is vertigo? Fear of falling? No, Vertigo is something other than fear of falling. It is the voice of the emptiness below us which tempts and lures us, it is the desire to fall, against which, terrified, we defend ourselves.","goals,success",3696
William Arthur Ward,The pessimist complains about the wind; the optimist expects it to change; the realist adjusts the sails.,realist,3695
George Carlin,"That's why they call it the American Dream, because you have to be asleep to believe it.",,3695
Lemony Snicket,All the secrets of the world are contained in books. Read at your own risk.,reading-secrets,3690
Salvador Dali,Have no fear of perfection - you'll never reach it.,"failure,fear,imperfection,mistakes,perfection,success",3690
Joss Whedon,Remember to always be yourself. Unless you suck.,individuality,3686
Ray Bradbury,"We are cups, constantly and quietly being filled. The trick is, knowing how to tip ourselves over and let the beautiful stuff out.",,3686
Charles Bukowski,"Some lose all mind and become soul,insane.",,3685
Mark Twain,Clothes make the man. Naked people have little or no influence on society.,clothing,3684
