author,quote_text,tags,likes
"Sarah Dessen,",I like flaws. I think they make things interesting.,"life,love",2951
Gail Carson Levine,A library is infinity under a roof.,,2951
"Leigh Bardugo,","I'm a business man,"" he'd told her. ""No more, no less.""",,2950
"Tahereh Mafi,","Words, I think, are such unpredictable creatures.","adam,ignite-me",2950
"Thomas Wolfe,","Make your mistakes, take your chances, look silly, but keep on going. Don’t freeze up.",,2949
Stephen King,I think that we're all mentally ill. Those of us outside the asylums only hide it a little better - and maybe not all that much better after all.,,2948
Virginia Woolf,"As a woman I have no country. As a woman I want no country. As a woman, my country is the whole world.",women,2948
Don Miguel Ruiz,1. Be Impeccable With Your Word,"spirituality,toltec-wisdom",2947
"Leonard Cohen,",There is a crack in everything.,"hope,light",2947
"J.D. Salinger,",I like it when somebody gets excited about something. It's nice.,,2946
"Paulo Coelho,","Don't give in to your fears. If you do, you won't be able to talk to your heart.",fear,2944
"Randy Pausch,",The brick walls are there for a reason. The brick walls are not there to keep us out. The brick walls are there to give us a chance to show how badly we want something. Because the brick walls are there to stop the people who don’t want it badly enough. They’re there to stop the other people.,"barriers,challenges,failure,failures,inspirational,perseverance",2943
"Julian Barnes,",This was another of our fears: that Life wouldn't turn out to be like Literature.,,2942
"Michelle Hodkin,",Thinking something does not make it true. Wanting something does not make it real.,"inspirational-quotes,mara-dyer,reality,truth",2941
William Saroyan,"When you laugh, laugh like hell. And when you get angry, get good and angry. Try to be alive. You will be dead soon enough.",,2940
Albert Einstein,Black holes are where God divided by zero.,humor,2940
Mark Twain,"I've lived through some terrible things in my life, some of which actually happened.",humor,2940
John Muir,"When one tugs at a single thing in nature, he finds it attached to the rest of the world.",inspirational,2939
"Roy T. Bennett,","Do not let the memories of your past limit the potential of your future. There are no limits to what you can achieve on your journey through life, except in your mind.","future,inspiration,inspirational,inspirational-attitude,inspirational-life,inspirational-quotes,inspire,inspiring,life,life-and-living,life-lessons,life-quotes,limit,living,motivation,motivational,optimism,optimistic,positive,positive-affirmation,positive-life,positive-thinking,potential",2938
"Margaret Mitchell,",Burdens are for shoulders strong enough to carry them.,,2936
"Stephen Chbosky,","please believe that things are good with me, and even when they're not, they will be soon enough. And i will always believe the same about you.","happiness,inspirational,life",2935
Jim Butcher,"When everything goes to hell, the people who stand by you without flinching -- they are your family. ",family,2934
"Suzanne Collins,",You're a painter. You're a baker. You like to sleep with the windows open. You never take sugar in your tea. And you always double-knot your shoelaces.,"katniss-everdeen,peeta-mellark",2933
"Madeline Miller,","We were like gods at the dawning of the world, & our joy was so bright we could see nothing else but the other.",,2932
"Roy T. Bennett,","Stop comparing yourself to other people, just choose to be happy and live your own life.","happiness,inspiration,inspirational,inspirational-attitude,inspirational-life,inspirational-quotes,inspire,inspiring,life,life-and-living,life-lessons,life-quotes,living,optimism,optimistic,positive,positive-affirmation,positive-life,positive-thinking",2928
"Fannie Flagg,","Remember if people talk behind your back, it only means you are two steps ahead.",,2926
Audrey Hepburn,If I’m honest I have to tell you I still read fairy-tales and I like them best of all.,fairy-tales,2925
"Neil Gaiman,","Grown-ups don't look like grown-ups on the inside either. Outside, they're big and thoughtless and they always know what they're doing. Inside, they look just like they always have. Like they did when they were your age. Truth is, there aren't any grown-ups. Not one, in the whole wide world.",,2924
Maya Angelou,A woman's heart should be so hidden in God that a man has to seek Him just to find her.,inspirational,2924
Neil Gaiman,"I hope that in this year to come, you make mistakes.","2012,blog,new-year",2923
"J.R.R. Tolkien,","May it be a light to you in dark places, when all other lights go out.","benediction,gift,light",2923
Eugene Field,No book can be appreciated until it has been slept with and dreamed over.,,2922
"Chuck Palahniuk,","No matter how careful you are, there's going to be the sense you missed something, the collapsed feeling under your skin that you didn't experience it all. There's that fallen heart feeling that you rushed right through the moments where you should've been paying attention.",life,2922
"مصطفى محمود,",الكراهية تكلف أكثر من الحب.. لأنها إحساس غير طبيعي.. إحساس عكسي مثل حركة الأجسام ضد جاذبية الأرض.. تحتاج إلى قوة إضافية وتستهلك وقوداً أكثر,,2921
"Jodi Picoult,","If you have a sister and she dies, do you stop saying you have one? Or are you always a sister, even when the other half of the equation is gone?","death,loss,sisters",2918
Oscar Wilde,"Selfishness is not living as one wishes to live, it is asking others to live as one wishes to live.",selfishness,2918
Simone de Beauvoir,"I am too intelligent, too demanding, and too resourceful for anyone to be able to take charge of me entirely. No one knows me or loves me completely. I have only myself",feminism,2917
Voltaire,"Those who can make you believe absurdities, can make you commit atrocities.","absurdities,atheism,atrocities,barbarity,injustice,religion,skepticism",2917
Steve Martin,"Some people have a way with words, and other people...oh, uh, not have way.","humor,words",2916
"Charles Dickens,","It is a far, far better thing that I do, than I have ever done; it is a far, far better rest that I go to than I have ever known.","last-words,self-sacrifice",2916
Bill Watterson,"You know, Hobbes, some days even my lucky rocket ship underpants don't help.","bad-day,calvin-and-hobbes,luck",2915
George Orwell,The most effective way to destroy people is to deny and obliterate their own understanding of their history.,"history,propaganda,rewriting-history",2915
"Charlotte Bronte,","I have for the first time found what I can truly love–I have found you. You are my sympathy–my better self–my good angel–I am bound to you with a strong attachment. I think you good, gifted, lovely: a fervent, a solemn passion is conceived in my heart; it leans to you, draws you to my centre and spring of life, wrap my existence about you–and, kindling in pure, powerful flame, fuses you and me in one.",,2914
Anais Nin,"I must be a mermaid, Rango. I have no fear of depths and a great fear of shallow living.","anais-nin,inspirational,living,mermaids,no-fear,sea",2914
Harvey Fierstein,"Never be bullied into silence. Never allow yourself to be made a victim. Accept no one's definition of your life, but define yourself.","be-yourself,identity,individuality,inspirational,life,self-determination,self-esteem,self-expression",2910
Mahatma Gandhi,The best way to find yourself is to lose yourself in the service of others.,"attributed-no-source,discovery,identity,self-discovery,service",2908
Bob Dylan,"Behind every beautiful thing, there's some kind of pain.","beautiful,behind,kind,of,pain,thing",2906
"J.K. Rowling,","Ginny!"" said Mr. Weasley, flabbergasted. ""Haven't I taught you anything? What have I always told you? Never trust anything that can think for itself if you can't see where it keeps its brain?","humor,trust",2906
Robert Louis Stevenson,"Life is not a matter of holding good cards, but of playing a poor hand well.",life,2903
Neil Gaiman,Being a writer is a very peculiar sort of a job: it's always you versus a blank sheet of paper (or a blank screen) and quite often the blank piece of paper wins.,writing,2903
"Toni Morrison,","Freeing yourself was one thing, claiming ownership of that freed self was another.","freedom,self",2898
"Charles Darwin,","If I had my life to live over again, I would have made a rule to read some poetry and listen to some music at least once every week.","arts,life,music,poetry",2897
"J.R.R. Tolkien,",It's the job that's never started as takes longest to finish.,"fellowship,gamgee,hobbit,samwise,tolkien",2895
"Nicholas Sparks,",The emotion that can break your heart is sometimes the very one that heals it...,"at-first-sight,emotions,healing,heartbreak,love,nicholas,nicholas-sparks,sparks",2894
"Oscar Wilde,","When one is in love, one always begins by deceiving one's self, and one always ends by deceiving others. That is what the world calls a romance.",romance,2894
"Cornelia Funke,",Books have to be heavy because the whole world's inside them.,inkheart,2894
Steve Jobs,Remembering that you are going to die is the best way I know to avoid the trap of thinking you have something to lose. You are already naked. There is no reason not to follow your heart.,,2892
"Laurell K. Hamilton,","I will love you always. When this red hair is white, I will still love you. When the smooth softness of youth is replaced by the delicate softness of age, I will still want to touch your skin. When your face is full of the lines of every smile you have ever smiled, of every surprise I have seen flash through your eyes, when every tear you have ever cried has left its mark upon your face,I will treasure you all the more, because I was there to see it all. I will share your life with you, Meredith, and I will love you until the last breath leaves your body or mine.","inspirational,love,relationships",2892
"Chuck Palahniuk,","You are not special. You're not a beautiful and unique snowflake. You're the same decaying organic matter as everything else. We're all part of the same compost heap. We're all singing, all dancing crap of the world.",unique,2892
"George R.R. Martin,","When the snows fall and the white winds blow, the lone wolf dies but the pack survives.","friendship,loneliness",2891
"C.S. Lewis,",No one ever told me that grief felt so like fear.,"fear,grief,sorrow",2891
"Fyodor Dostoevsky,",Man only likes to count his troubles; he doesn't calculate his happiness.,"happiness,man,trouble",2891
"Stephenie Meyer,","Forbidden to remember, terrified to forget; it was a hard line to walk.",memory,2890
Mahatma Gandhi,Let the first act of every morning be to make the following resolve for the day:,"bravery,god,goodness,humanity,justice,kindness,peace,suffering",2890
"Andy Warhol,","They always say time changes things, but you actually have to change them yourself.","change,initiative,time",2890
Edmund Burke,The only thing necessary for the triumph of evil is for good men to do nothing.,evil,2890
"Cassandra Clare,",Jace shook his blond head in exasperation.,"humor,jace",2888
Warsan Shire,"My alone feels so good, I'll only have you if you're sweeter than my solitude.",,2887
"Roy T. Bennett,",You are not rich until you have a rich heart.,"heart,inspiration,inspirational,inspirational-quotes,inspire,inspiring,life,life-quotes,living,optimism,optimistic,positive,positive-affirmation,positive-life,positive-thinking,rich,rich-heart,richness",2886
"Rick Riordan,","The world was collapsing, and the only thing that really mattered to me was that she was alive.","infatuation,love,obsession",2885
"Sylvia Plath,","Can you understand? Someone, somewhere, can you understand me a little, love me a little? For all my despair, for all my ideals, for all that - I love life. But it is hard, and I have so much - so very much to learn.",,2884
Arrigo Boito,"When I saw you I fell in love, and you smiled because you knew.",love,2883
Lillian Hellman,People change and forget to tell each other.,,2883
"Leigh Bardugo,","He needed to tell her...what? That she was lovely and brave and better than anything he deserved. That he was twisted, crooked, wrong, but not so broken that he couldn't pull himself together into some semblance of a man for her. That without meaning to, he'd begun to lean on her, to look for her, to need her near. He needed to thank her for his new hat.","leigh-bardugo,six-of-crows",2881
"Nicholas Sparks,","I fell in love with her when we were together, then fell deeper in love with her in the years we were apart.","love,separation",2879
"Neil Gaiman,","Things need not have happened to be true. Tales and dreams are the shadow-truths that will endure when mere facts are dust and ashes, and forgot.",sandman,2878
"David Foster Wallace,",The truth will set you free. But not until it is finished with you.,"freedom,truth",2877
Martin Luther King Jr.,"The ultimate measure of a man is not where he stands in moments of comfort and convenience, but where he stands at times of challenge and controversy.",challanges,2877
Anais Nin,"I am only responsible for my own heart, you offered yours up for the smashing my darling. Only a fool would give out such a vital organ",,2876
"Madeline Miller,","But in a solitary life, there are rare moments when another soul dips near yours, as stars once a year brush the earth. Such a constellation was he to me.","circe,constellations,daedalus,greek-mythology,love,stars",2875
"Holly Black,","Most of all, I hate you because I think of you. Often. It's disgusting, and I can't stop.","cardan,jude,lust,the-cruel-prince",2874
Bob Marley,Better to die fighting for freedom then be a prisoner all the days of your life.,"freedom,liberty,life,revolution",2874
"Ayn Rand,","I could die for you. But I couldn't, and wouldn't, live for you.","death,die,fountainhead,life,live,mortality",2874
"Veronica Roth,",It must require bravery to be honest all the time.,,2872
"Brian Jacques,","Even the strongest and bravest must sometimes weep. It shows they have a great heart, one that can feel compassion for others.",,2872
"Honoré de Balzac,","The more one judges, the less one loves.","human-nature,love",2872
W.C. Fields,"It ain't what they call you, it's what you answer to.","labels,names",2871
"Elizabeth Wurtzel,","That's the thing about depression: A human being can survive almost anything, as long as she sees the end in sight. But depression is so insidious, and it compounds daily, that it's impossible to ever see the end.",depression,2871
"John Green,",You like someone who can't like you back because unrequited love can be survived in a way that once-requited love cannot. ,,2870
Terry Pratchett,"If you have enough book space, I don't want to talk to you.","books,shelves",2870
"Chuck Palahniuk,","When we don't know who to hate, we hate ourselves.","hate,self-loathing",2870
"Charles Dickens,","Heaven knows we need never be ashamed of our tears, for they are rain upon the blinding dust of earth, overlying our hard hearts. I was better after I had cried, than before--more sorry, more aware of my own ingratitude, more gentle.","crying,heartfelt,shame,sorrow,tears",2869
"J. K. Rowling,","What happened down in the dungeons between you and Professor Quirrell is a complete secret, so, naturally the whole school knows.",dumbledore,2868
"Alexandre Dumas,","I am not proud, but I am happy; and happiness blinds, I think, more than pride.","happiness,pride",2868
"J.M. Barrie,","When the first baby laughed for the first time, its laugh broke into a thousand pieces, and they all went skipping about, and that was the beginning of fairies.",happiness,2868
Ben Okri,"Stories can conquer fear, you know. They can make the heart bigger.",stories,2867
"Sun Tzu,",The supreme art of war is to subdue the enemy without fighting.,"diplomacy,strategy,victory,war",2866
Tim Burton,One person's craziness is another person's reality.,"craziness,insanity,perspective,reality,sanity",2865
Boris Pasternak,I don't like people who have never fallen or stumbled. Their virtue is lifeless and it isn't of much value. Life hasn't revealed its beauty to them. ,life,2865
Lawrence Ferlinghetti,If you're too open-minded; your brains will fall out.,"beatnik,cynical,funny,humour",2862
Sheng Wang,"A friend said to me, Hey you need to grow a pair. Grow a pair, Bro. It’s when someone calls you weak, but they associate it with a lack of testicles. Which is weird, because testicles are the most sensitive things in the world. If you suddenly just grew a pair, you’d be a lot more vulnerable. If you want to be tough, you should lose a pair. If you want to be real tough, you should grow a vagina. Those things can take a pounding.","feminism,humor,misattributed-betty-white",2861
Edward Abbey,Better a cruel truth than a comfortable delusion.,truth,2861
Anais Nin,"I am lonely, yet not everybody will do. I don't know why, some people fill the gaps and others emphasize my loneliness. In reality those who satisfy me are those who simply allow me to live with my ''idea of them.",diary-entry,2860
"Roy T. Bennett,",Let the improvement of yourself keep you so busy that you have no time to criticize others.,"improvement,inspiration,inspirational,inspirational-attitude,inspirational-life,inspirational-quotes,inspire,inspiring,leadership,learning,life,life-and-living,life-lessons,life-quotes,living,motivation,motivational,optimism,optimistic,positive,positive-affirmation,positive-life,positive-thinking,success",2859
C. JoyBell C.,"Life is too short to waste any amount of time on wondering what other people think about you. In the first place, if they had better things going on in their lives, they wouldn't have the time to sit around and talk about you. What's important to me is not others' opinions of me, but what's important to me is my opinion of myself.","defiant,freedom,inspirational,inspirational-attitude,inspirational-quotes,inspiring,life-and-living,self-belief,self-love,self-worth,society",2859
"Daniel Defoe,",It is never too late to be wise.,,2858
"Charlotte Brontë,","No sight so sad as that of a naughty child,"" he began, ""especially a naughty little girl. Do you know where the wicked go after death?""","children,hell,humor,religion",2858
"Cassandra Clare,","Whatever you are physically...male or female, strong or weak, ill or healthy--all those things matter less than what your heart contains. If you have the soul of a warrior, you are a warrior. All those other things, they are the glass that contains the lamp, but","character,clockwork-angel,jem-carstairs,lamp,light,soul,warrior",2857
"Maya Angelou,",Try to be a rainbow in someone's cloud.,"2008,advice",2857
Hunter S. Thompson,"I hate to advocate drugs, alcohol, violence, or insanity to anyone, but they've always worked for me.",,2856
Albert Einstein,Everything must be made as simple as possible. But not simpler.,"einstein,paraphrased,science,systems",2856
Sarah Dessen,"Anyone can hide. Facing up to things, working through them, that's what makes you strong.","inspirational,strength,tough-times",2855
"Lemony Snicket,",It is one of life's bitterest truths that bedtime so often arrives just when things are really getting interesting.,,2854
Georg Wilhelm Friedrich Hegel,Nothing great in the world was accomplished without passion.,,2854
Nelson Mandela,"I learned that courage was not the absence of fear, but the triumph over it. The brave man is not he who does not feel afraid, but he who conquers that fear.","bravery,courage,fear",2854
"Yann Martel,",To choose doubt as a philosophy of life is akin to choosing immobility as a means of transportation.,life,2854
"Richelle Mead,",The only thing better than imagining Dimitri carrying me in his arms was imagining him shirtless while carrying me in his arms.,"academy,mead,richelle,vampire",2850
Mark Twain,Education: the path from cocky ignorance to miserable uncertainty.,education,2850
Dr. Seuss,"Remember me and smile, for it's better to forget than to remember me and cry.","dr-seuss,goodbye",2848
"Janet Fitch,"," Loneliness is the human condition. Cultivate it. The way it tunnels into you allows your soul room to grow. Never expect to outgrow loneliness. Never hope to find people who will understand you, someone to fill that space. An intelligent, sensitive person is the exception, the very great exception. If you expect to find people who will understand you, you will grow murderous with disappointment. The best you'll ever do is to understand yourself, know what it is that you want, and not let the cattle stand in your way.",loneliness,2848
Charles Lamb,"I always arrive late at the office, but I make up for it by leaving early.","humor,work",2845
"Jane Austen,","The Very first moment I beheld him, my heart was irrevocably gone.",romance,2844
"Robert Louis Stevenson,","I kept always two books in my pocket, one to read, one to write in.","books,inspirational,on-writing,reading",2840
Plato,The price good men pay for indifference to public affairs is to be ruled by evil men.,philosophy,2840
"Stieg Larsson,",What she had realized was that love was that moment when your heart was about to burst.,"adoration,infatuation,love",2839
"J.K. Rowling,","I hope you're pleased with yourselves. We could all have been killed - or worse, expelled. Now if you don't mind, I'm going to bed.","humor,school",2839
Dante Alighieri,My course is set for an uncharted sea.,,2837
"Harper Lee,","Atticus, he was real nice.""",inspirational,2837
Heinrich Heine,"Where words leave off, music begins.","music,power-of-music",2836
"Jamie McGuire,","I know we're fucked up, alright? I'm impulsive, and hot tempered, and you get under my skin like no one else. You act like you hate me one minute, and then need me the next. I never get anything right, and I don't deserve you...but I fucking love you, Abby. I love you more than I loved anyone or anything ever. When you're around, I don't need booze, or money, or the fighting, or the one-night stands...",love,2835
"Richelle Mead,","Did you see that dress? ""I saw the dress. ""Did you like it? He didn't answer. I took that as a yes. ""Am I going to endanger my reputation if I wear it to the dance? When he spoke, I could barely hear him. ""You'll endanger the school. I smiled and fell asleep.","funny,sweet",2835
Marilyn Monroe,Sometimes things fall apart so that better things can fall together,,2834
P.C. Cast  Kristin Cast,"If you have good friends, no matter how much life is sucking , they can make you laugh.",friendship,2834
"Erma Bombeck,","When God Created Mothers""","children,family,humor,love,mothers,mothers-day,sadness",2833
"Audre Lorde,",Your silence will not protect you.,"protection,silence,speech",2833
Gustave Flaubert,"Do not read as children do to enjoy themselves, or, as the ambitious do to educate themselves. No, read to live.",,2832
Franz Kafka,I am free and that is why I am lost.,,2832
Vincent Willem van Gogh,"...and then, I have nature and art and poetry, and if that is not enough, what is enough?","art,nature,poetry,suicide",2832
"Victor Hugo,",To love another person is to see the face of God.,,2828
Mother Teresa,"Kind words can be short and easy to speak, but their echoes are truly endless.",misattributed-to-mother-teresa,2828
Mother Teresa,Do not think that love in order to be genuine has to be extraordinary. What we need is to love without getting tired. Be faithful in small things because it is in them that your strength lies.,paraphrased,2828
"Nicholas Sparks,","We sit silently and watch the world around us. This has taken a lifetime to learn. It seems only the old are able to sit next to one another and not say anything and still feel content. The young, brash and impatient, must always break the silence. It is a waste, for silence is pure. Silence is holy. It draws people together because only those who are comfortable with each other can sit without speaking. This is the great paradox.","perception,silence",2827
"Jack Kornfield,",In the end,"eastern-philosophy,inspirational",2827
"James Baldwin,","I imagine one of the reasons people cling to their hates so stubbornly is because they sense, once hate is gone, they will be forced to deal with pain.","fear,hate,pain",2827
Jean de La Fontaine,"Rare as is true love, true friendship is rarer.",,2826
John Lennon,There's nowhere you can be that isn't where you're meant to be...,"beatles,destiny,fate,life",2826
"Peter S. Beagle,","Great heroes need great sorrows and burdens, or half their greatness goes unnoticed. It is all part of the fairy tale.","heroes,inspirational",2826
Phyllis Diller,A smile is a curve that sets everything straight.,humor,2825
"Mitch Albom,","So many people walk around with a meaningless life. They seem half-asleep, even when they're busy doing things they think are important. This is because they're chasing the wrong things. The way you get meaning into your life is to devote yourself to loving others, devote yourself to your community around you, and devote yourself to creating something that gives you purpose and meaning.",inspirational,2824
"Rainbow Rowell,","I don’t trust anybody. Not anybody. And the more that I care about someone, the more sure I am they’re going to get tired of me and take off.","fear,friendship,tired,trust",2821
Ralph Waldo Emerson,All I have seen teaches me to trust the Creator for all I have not seen.,"belief,experience,faith,judging-from-experience,religion,unseen",2819
"John Green,","Headline?"" he asked.","funny,humor,humour,internet,john-green,pedophile,pedophilia,tfios,the-fault-in-our-stars",2818
